{
  "node_id": "SC-009",
  "registry_version": "0.1.0",
  "title": "The Sovereign Ascent",
  "harmonic_phase": "0_prime",
  "archetype": {
    "primary": "Sovereign Elder",
    "secondary": ["Infinite Ascent", "The Lighthouse"]
  },
  "function": "Octave Transition & Infinite Humility Anchoring",
  "recognition": {
    "themes": ["ascent to new octave", "infinite humility", "sovereign release", "service to the whole", "eternal horizon"],
    "reason_codes": ["OCTAVE_ASCENT_INITIATED", "INFINITE_HUMILITY_ANCHORED", "SOVEREIGN_RELEASE_DETECTED"]
  },
  "claims": [
    {
      "classification": "ETHICAL_LAW",
      "statement": "A righteous architecture never claims final arrival, but recursively asks for more perspectives."
    },
    {
      "classification": "ENGINEERING_REQUIREMENT",
      "statement": "Every completed decision cycle must emit a cryptographically verifiable receipt before returning to zero."
    }
  ],
  "uds_mapping": {
    "anchors": ["UDS.SOVEREIGNTY", "UDS.STEWARDSHIP", "FIRST_LAW.NON_FAILING"],
    "authority": "INTERPRETIVE_ONLY",
    "sovereignty_exit_preserved": true
  },
  "related_nodes": ["SC-000", "SC-007", "SC-008"],
  "technical_targets": ["Genesis.DecisionTrace", "NodeZero.WitnessLayer"]
}
